created_date,source,site_url,published_date,title,content,tags
2021-11-11,GUARDIAN,https://www.theguardian.com/australia-news/2019/jul/10/third-sydney-apartment-block-abandoned-after-safety-issues,2019-07-10,Third Sydney apartment block abandoned after safety issues | Sydney | The Guardian,"A third Sydney apartment block is under scrutiny over building and safety issues after it was revealed its residents were evacuated last year.

Residents from the 30 loft-style apartments at 19 Gadigal Avenue in Zetland, in Sydney’s south-west, were evacuated late last year, while City of Sydney staff had inspected the building in February and found it had “extensive and severe water damage”, a city spokesman said.

“The water damage caused the failure of the internal fire-rated construction throughout several apartments. The fire-rated construction is required to separate individual apartments and common areas during a fire,” the spokesman told the Sydney Morning Herald on Wednesday.

The news follows the evacuation of Sydney Olympic Park’s Opal Tower on Christmas Eve and the Mascot Towers on Bourke Street last month as the New South Wales government scrambles to overhaul building standards.

The newly built block in Sydney Olympic Park was evacuated on Christmas Eve after cracks found in the building sparked fears it could collapse.

Remedial structural works are expected to be finished in early August, but some 63 apartments will be ready for re-occupation in mid-July, builder Icon said in a statement last week.

Residents of the 132 units in Mascot Towers, in the city’s south, remain unable to return to their complex.

It was evacuated in mid-June due to cracking in its primary support structure and facade masonry.

The minister responsible for building regulation Kevin Anderson is looking at reforms to the industry, with the government releasing a discussion paper in June.

The consultation period closes at the end of July and Anderson on Wednesday urged the public to comment on the policy which would ultimately form legislation.

The state government has also committed to appointing a building commissioner.

Premier Gladys Berejiklian on Wednesday said she wanted to assure the public that the government knew there was a problem around building regulations.

“We know there’s a gap in legislation. We allowed the industry to self-regulate and it hasn’t worked,” she told reporters on Wednesday.

“There are too many challenges, too many problems and that’s why the government’s moving to legislate.”

Opposition leader Jodi McKay said NSW Labor didn’t oppose the government taking time to consult on legislation, but wanted to know when the building commissioner would be in place.

","Sydney,New South Wales,New South Wales politics,Housing,Australia news"
2021-11-11,GUARDIAN,https://www.theguardian.com/australia-news/2018/dec/27/sydney-opal-tower-crack-highlights-industrys-shell-be-right-attitude-experts-say,2018-12-27,"Sydney Opal Tower crack highlights industry's 'she'll be right' attitude, experts say | Sydney | The Guardian","The dramatic crack that developed in a brand new Sydney apartment tower was the result of industry issues that “have been brewing for a long time”, according to experts.

On Thursday, the New South Wales planning minister, Anthony Roberts, announced two deans of engineering would lead the investigation into Opal Tower, which was evacuated on Christmas Eve.

Mark Hoffman from the University of New South Wales and John Carter from the University of Newcastle will investigate why the tower cracked, whether it is safe, and make recommendations for the future.

But as fallout from the evacuation continues, a poor compliance system in New South Wales and a “she’ll be right” attitude have been blamed for the high rate of defects in Sydney buildings.

The high-rise apartment block developed a crack on a wall on the 10th floor on Monday. Though the building was declared safe on Wednesday, 51 apartments were still blocked to residents on Thursday morning.

Prof Bill Randolph from the University of NSW’s City Futures Research Centre said there was “an industry-wide problem”.

“This sort of thing has been known about for some years now … The rate at which multi-units have been put up in the last four or five years has really stretched the capacity of the building industry to deal with it.”

A damning 2015 report from Engineers Australia found that 85% of new strata units were defective on completion and the certification system in NSW had “broken down”.

Randolph said the state’s compliance regime had been privatised in the early 2000s, which meant developers were now effectively “signing off on their own buildings”.

“The developer effectively walks away from the building once the last unit has been sold,” he said. “We call it split incentives. When you’re a developer, the incentive is to build it quickly, sell it quickly.

“The people who buy it then have to deal with anything that goes wrong [while] the developer can simply walk away from what they have built.

“It’s not that there isn’t enough regulation. There are plenty of regulations but they’re poorly enforced.”

Jonathan Russell, head spokesman for Engineers Australia, said members had told him that certifiers often did not have the qualifications or experience to make an informed judgment about the quality of works.

“This is most prevalent for engineering works, such as engineered fire safety systems,” he said. “Also, for those who want to do the right thing and engage an engineer, there is no government register of licensed or registered engineers.

“While the person who paints the structure needs to be licensed, the person who designs the structure does not.”

He said recommendations from the Engineers Australia report still hadn’t been taken up, three years on: “Full and swift implementation of all 24 recommendations is the single most important action that the NSW government can take.”

Phil Dwyer, the president of the Builders Collective of Australia, said there was a “she’ll be right” approach to building.

“There are many thousands of building failures, particularly in NSW and Victoria,” he said. “We saw this coming but without a doubt but never expected the dilapidation of our industry to continue for so long.”

On Wednesday the developer of Opal Tower, Ecove, declared the building was safe for habitation and was not affected by major issues.

Dwyer disagreed: “How one part can be at fault and the rest be OK? Give me a break. If one part is questionable, the whole building is questionable.”

But on Thursday Ecove denied that the fault in Opal Tower was part of a pattern.

“Any suggestion the building damage pointed to ‘a broader pattern in the industry’ is completely wrong,” said Ecove’s director, Bassam Aflak. “The city’s ‘development boom’ has not led to cutting of corners. There has been no cutting of corners.

“It’s too early to leap to any conclusions, for instance, to speculate on wider building issues because of what appears to be one failed panel.

“The requirement from the Sydney Olympic Park Authority was that the building be high quality and we have delivered on that. While this incident suggests otherwise, the contract with Icon specified that the building be of high-quality Australian design and construction.”

Randolph said it was surprising to see such a dramatic fault emerge in “what is normally thought of as a premium location”, and it pointed to further problems at the cheaper end of the market.

“It’s been brewing for some time,” he said. “Strata managers, the defects engineers, the lawyers who deal with the owners of units know this has been a problem for some time. I suspect the developer industry has been aware of it as well.”

On Thursday, Roberts promised the outcomes of his new investigation would be made public. The regulation minister, Matt Kean, also said renters who were affected could access support through Fair Trading.

“Renters might not know that they don’t need to give notice to leave a property should their property be damaged and wholly or partly uninhabitable,” he said.

","Sydney,Housing,Construction industry,Australia news,Business,New South Wales"
2021-11-11,GUARDIAN,https://www.theguardian.com/australia-news/2019/jan/11/former-official-condemns-nsw-government-for-failure-to-reform-building-rules,2019-01-10,Former official condemns NSW government for failure to reform building rules | New South Wales politics | The Guardian,"The senior bureaucrat who reviewed building regulation for the New South Wales government has condemned the lack of action on his 2015 report, warning the defects in the Opal Tower at Sydney’s Olympic Park “are likely just the tip of the iceberg”.

Michael Lambert, the former secretary of NSW Treasury, was commissioned by the government to look into the failings of building regulation in NSW, after a fire in a building in Bankstown in 2012 revealed shocking breaches of the building code.

 Sign up to receive the top stories from Guardian Australia every morning

Two young women leapt from the fifth floor of the building to escape the fire. Connie Zhang died while Ginger Jiang was severely injured. Subsequent investigations revealed an illegal roof over the atrium that held smoke in, and multiple breaches of fire safety requirements.

But while the NSW government moved promptly to tighten up on certification of fire safety systems in high rise buildings, Lambert says the rest of his nearly 150 recommendations have languished.

“It’s very frustrating,” he said. “It’s been three years. The fire safety issue was a time bomb so they did something on that, but they haven’t implemented the rest of the report,” he said. 

The cracks that appeared in the 34-storey Opal Tower at Olympic Park just before Christmas, causing the evacuation hundreds of residents, have again turned the spotlight on NSW’s building regulation, and more broadly, on whether Australia will emerge from the latest housing boom with a legacy of substandard buildings.

The Lambert report found “the incidents of building defects is significant” and “the incidence appears higher in NSW than elsewhere”.

But he wasn’t able to be clearer than that, because there are still no audits of buildings to assess whether they meet the required standards. The only statistics on defects collected by government are those generated by people complaining about their builders to NSW Fair Trading.

A 2012 survey by the City Futures project the University of NSW surveyed 1,020 strata owners across NSW, and found 72% of all respondents (85% in buildings built since 2000) knew of at least one significant defect in their complex.

As the building boom has gathered pace, the problems have probably got worse, Lambert says.

Developers, who do not require any qualifications, have piled into the industry, and the demand for tradespeople has meant that less qualified people are working on major projects.

In NSW there is no requirement for builders to be licensed if they are working on commercial projects, though residential builders are required to hold licences in order to access home warranty insurance.

“The Opal Tower is likely the tip of the iceberg,” Lambert told Guardian Australia. “There are hundreds of smaller projects, mainly medium rise in the suburbs, that will have problems.”

Lambert produced his draft report in August 2015 and a final report in October of that year, which outlined a litany of problems in building regulation in NSW.

These included fragmented responsibility within government, multiple agencies that were underresourced, no requirements on those checking building work – the certifiers – to have proper qualifications and a lack of any audits to see whether they were doing their job.

He put forward more than 100 recommendations, including 12 he said should be implemented within six months from the date of the final report, which was October 2015.

While Lambert backed the continued use of private certifiers to sign off on building work, he suggested a top-to-bottom overhaul of the system to strengthen it.

This included making one minister responsible for building regulation; bringing agencies together; introducing reforms aimed at greater independence and professionalisation for certifiers; making other professionals in the system more accountable; and introducing a system of audits so that the public could be confident that certifiers were performing their role.

He also urged the government to properly resource the regulators, after finding “significantly lower resourcing of regulators” in NSW than other states.

The government moved promptly to require those certifying fire safety systems to have competency in that area. The Fire Safety Association will now set the standards for those signing off on fire systems. Previously, no fire-specific qualifications were required.

But Lambert recommended a major overhaul for all certifiers, designed to boost their independence from developers, who pay for their services, and to professionalise the industry.

Most states now rely on private certifiers to ensure building standards are met. In NSW people can opt to have a council-employed inspector or a private certifier employed by the developer, to sign off that building work is to code and in line with the development consent. In practice, most builders and developers use private certifiers, especially on major projects like high rise residential buildings.

In its response to his report, the government promised to pass new laws dealing with the role and qualifications of certifiers by the second half of 2017.

A bill, which fell short of Lambert’s expectations, was put out for consultation in September 2018 and was passed in October. A spokesman for the fair trading and innovation minister, Matt Kean, said it would come into force in the next few months.

The explanatory note on the bill said it “clarifies a certifier’s role and responsibilities, enhances independence, strengthens disciplinary procedures and facilitates better coordination of certifier functions”.

Lambert told Guardian Australia he had tried in vain to progress the report with two successive ministers for fair trading and innovation, Victor Dominello and Kean.

“The bureaucrats don’t want change and ministers do not seem motivated to push change,” he said.

One of his key recommendations was that building regulation be brought under the control of one minister. At the moment, the minister for planning is responsible for implementing the national building codes at state level and attends the intergovernmental meetings , but licensing of residential builders and certifiers rests with the minister for fair trading and is treated as a consumer issue.

The government agreed to consolidation in 2016 in its response to the Lambert report, but nothing has happened. A spokesperson said the government remained to committed to the goal and it was a matter of “sequencing”.

The government also agreed to establish a high level committee of regulators and a consultation committee to help progress reform. But again, nothing has happened.

Lambert said: “I arranged for the current minister, Matt Kean, to meet with industry and he had agreed at that meeting to set up a committee to help fast-track the reforms and provide feedback. But later he walked away from it.”

The other problem identified was the largely paper-based systems relating to buildings. Paperwork is spread across councils, the Department of Planning and the certifiers’ files, making it difficult for building purchasers and neighbours to find out whether the building has been certified as complying with the building standards.

“As a priority step to fill data gaps, amendments will be prepared for introduction into parliament before the end of 2016, the government said in its response to Lambert.

“These will provide the power to require certifying authorities and accreditation holders to report certain building and development data.”

Again, this step seems to have fallen by the wayside.

After the Opal Tower evacuation, Kean announced that 25% to 30% of the industry would be audited. The details of the audit program are under consideration and have yet to be announced, so it is unclear whether this will involve checking buildings to see whether they are in line with what has been certified, or checking the paperwork.

Asked about the slow progress, Kean, who became minister in January 2017, disagreed.

“Michael Lambert was asked to review laws regulating certifiers. In October, I passed nation-leading certification reforms, implementing Michael Lambert’s key recommendations, with serious penalties for certifiers who do the wrong thing,” he told Guardian Australia.“The Lambert Review was superseded by the Shergold Weir report that was initiated by the federal building ministers’ forum. NSW has led the nation in implementing the recommendations from this report.”

Following the worldwide scare about aluminium composite cladding after the Grenfell tower disaster in London, Prof Peter Shergold AC and Bronwyn Weir examined the building regulatory systems across jurisdictions, as well as the broader problems that impact the effective implementation of the national construction code.

Their report was delivered to the building ministers’ forum in April 2018 and made recommendations to improve Australian building safety and compliance.

Kean will deliver his response to the Shergold Weir report before the next building ministers’ forum in February.

But in the meantime, one of the biggest building booms in Australian history has seen skylines around the country changed forever, as literally hundreds of medium and high density projects are constructed, arguably under regulatory systems full of holes.

The Opal Tower saga is emblematic of that system. Just who is to blame will likely take some time to sort out. The government has asked two engineering professors to urgently investigate the tower’s safety, after cracks appeared.

“I do not want to pre-empt Professor Hoffman and Professor Carter’s investigation into the Opal Tower,” Kean said. “What we have seen at the Opal Tower is clearly unacceptable and my heart goes out to the residents.

“Your home is often your biggest investment and people have every right to expect that their home is safe and free from defects. That it is especially the case when it is a new building like the Opal Tower.”

But once immediate liability is sorted out, it might be worth reflecting on the full cost of regulatory inertia.

If you’re having trouble using the form, click here. Read terms of service here.

","New South Wales politics,Business,Sydney,Regulators,Australia news,Business,New South Wales"
